{"active_regions": [{"id": 1, "birth_seconds": 0.0, "lat_deg": -20.087121, "lon_deg": 7.811522, "flux_norm": 1.85705, "area_msh": 1906.745542, "tilt_deg": -14.521751, "complexity": 0.97597, "polarity": "leading_negative", "confidence": 0.65}, {"id": 2, "birth_seconds": 3600.0, "lat_deg": 20.336583, "lon_deg": 127.392353, "flux_norm": 0.983479, "area_msh": 964.702709, "tilt_deg": 10.963454, "complexity": 0.452613, "polarity": "leading_negative", "confidence": 0.65}, {"id": 3, "birth_seconds": 7200.0, "lat_deg": -22.347449, "lon_deg": 291.385264, "flux_norm": 1.495159, "area_msh": 1606.806038, "tilt_deg": -10.475308, "complexity": 0.809337, "polarity": "leading_positive", "confidence": 0.65}, {"id": 4, "birth_seconds": 10800.0, "lat_deg": -17.619487, "lon_deg": 259.859736, "flux_norm": 0.635545, "area_msh": 1090.206223, "tilt_deg": -13.189355, "complexity": 0.522337, "polarity": "leading_positive", "confidence": 0.65}, {"id": 5, "birth_seconds": 14400.0, "lat_deg": 22.923797, "lon_deg": 211.663364, "flux_norm": 1.093588, "area_msh": 914.427911, "tilt_deg": 13.092303, "complexity": 0.424682, "polarity": "leading_negative", "confidence": 0.65}, {"id": 6, "birth_seconds": 18000.0, "lat_deg": -22.55415, "lon_deg": 359.222935, "flux_norm": 2.088306, "area_msh": 1846.419726, "tilt_deg": -5.446029, "complexity": 0.942455, "polarity": "leading_negative", "confidence": 0.65}, {"id": 7, "birth_seconds": 21600.0, "lat_deg": 17.929198, "lon_deg": 328.021145, "flux_norm": 1.817529, "area_msh": 1312.394251, "tilt_deg": 17.498364, "complexity": 0.645775, "polarity": "leading_positive", "confidence": 0.65}, {"id": 8, "birth_seconds": 25200.0, "lat_deg": -16.204302, "lon_deg": 355.718712, "flux_norm": 1.143872, "area_msh": 1006.381698, "tilt_deg": -7.096984, "complexity": 0.475768, "polarity": "leading_positive", "confidence": 0.65}, {"id": 9, "birth_seconds": 28800.0, "lat_deg": 23.144793, "lon_deg": 53.763953, "flux_norm": 1.103491, "area_msh": 1550.183891, "tilt_deg": 6.188628, "complexity": 0.77788, "polarity": "leading_positive", "confidence": 0.65}, {"id": 10, "birth_seconds": 32400.0, "lat_deg": 18.190835, "lon_deg": 259.479471, "flux_norm": 2.151192, "area_msh": 1948.433574, "tilt_deg": 5.275291, "complexity": 0.99913, "polarity": "leading_positive", "confidence": 0.65}, {"id": 11, "birth_seconds": 36000.0, "lat_deg": 19.10481, "lon_deg": 167.817055, "flux_norm": 0.770981, "area_msh": 989.875697, "tilt_deg": 15.552605, "complexity": 0.466598, "polarity": "leading_positive", "confidence": 0.65}, {"id": 12, "birth_seconds": 39600.0, "lat_deg": -21.90527, "lon_deg": 253.76695, "flux_norm": 0.454584, "area_msh": 1316.790667, "tilt_deg": -17.451586, "complexity": 0.648217, "polarity": "leading_positive", "confidence": 0.65}, {"id": 13, "birth_seconds": 43200.0, "lat_deg": 17.392259, "lon_deg": 244.952892, "flux_norm": 1.942342, "area_msh": 1619.797686, "tilt_deg": 11.592929, "complexity": 0.816554, "polarity": "leading_positive", "confidence": 0.65}, {"id": 14, "birth_seconds": 46800.0, "lat_deg": -22.808309, "lon_deg": 151.37417, "flux_norm": 2.167428, "area_msh": 1752.68626, "tilt_deg": -6.249333, "complexity": 0.890381, "polarity": "leading_positive", "confidence": 0.65}, {"id": 15, "birth_seconds": 50400.0, "lat_deg": 22.146119, "lon_deg": 112.402928, "flux_norm": 2.040877, "area_msh": 1675.514069, "tilt_deg": 17.572665, "complexity": 0.847508, "polarity": "leading_positive", "confidence": 0.65}, {"id": 16, "birth_seconds": 54000.0, "lat_deg": -18.533236, "lon_deg": 88.309908, "flux_norm": 1.501474, "area_msh": 1353.771634, "tilt_deg": -21.138388, "complexity": 0.668762, "polarity": "leading_positive", "confidence": 0.65}, {"id": 17, "birth_seconds": 57600.0, "lat_deg": 19.372112, "lon_deg": 188.978365, "flux_norm": 1.044264, "area_msh": 912.515927, "tilt_deg": 5.262621, "complexity": 0.42362, "polarity": "leading_positive", "confidence": 0.65}, {"id": 18, "birth_seconds": 61200.0, "lat_deg": -17.002502, "lon_deg": 260.422802, "flux_norm": 1.705925, "area_msh": 1401.676919, "tilt_deg": -5.976803, "complexity": 0.695376, "polarity": "leading_positive", "confidence": 0.65}, {"id": 19, "birth_seconds": 64800.0, "lat_deg": 17.702769, "lon_deg": 173.63244, "flux_norm": 1.090051, "area_msh": 1776.717823, "tilt_deg": 17.458667, "complexity": 0.903732, "polarity": "leading_positive", "confidence": 0.65}, {"id": 20, "birth_seconds": 68400.0, "lat_deg": -16.877677, "lon_deg": 228.61848, "flux_norm": 0.814791, "area_msh": 1797.26317, "tilt_deg": -21.752652, "complexity": 0.915146, "polarity": "leading_positive", "confidence": 0.65}, {"id": 21, "birth_seconds": 72000.0, "lat_deg": -17.334601, "lon_deg": 168.62777, "flux_norm": 0.522095, "area_msh": 1318.124234, "tilt_deg": -4.520077, "complexity": 0.648958, "polarity": "leading_negative", "confidence": 0.65}, {"id": 22, "birth_seconds": 75600.0, "lat_deg": 17.461378, "lon_deg": 223.473948, "flux_norm": 0.841383, "area_msh": 1063.599852, "tilt_deg": 11.660609, "complexity": 0.507555, "polarity": "leading_positive", "confidence": 0.65}, {"id": 23, "birth_seconds": 79200.0, "lat_deg": -19.786958, "lon_deg": 239.06385, "flux_norm": 2.131326, "area_msh": 1610.029872, "tilt_deg": -14.79134, "complexity": 0.811128, "polarity": "leading_negative", "confidence": 0.65}, {"id": 24, "birth_seconds": 82800.0, "lat_deg": 22.154815, "lon_deg": 334.983856, "flux_norm": 1.057278, "area_msh": 858.794706, "tilt_deg": 8.378979, "complexity": 0.393775, "polarity": "leading_negative", "confidence": 0.65}, {"id": 25, "birth_seconds": 86400.0, "lat_deg": -17.074688, "lon_deg": 125.280725, "flux_norm": 1.57449, "area_msh": 1672.434334, "tilt_deg": -14.28735, "complexity": 0.845797, "polarity": "leading_negative", "confidence": 0.65}, {"id": 26, "birth_seconds": 90000.0, "lat_deg": 23.719903, "lon_deg": 208.266774, "flux_norm": 1.30329, "area_msh": 822.804001, "tilt_deg": 14.128936, "complexity": 0.37378, "polarity": "leading_positive", "confidence": 0.65}, {"id": 27, "birth_seconds": 93600.0, "lat_deg": 18.071741, "lon_deg": 78.058334, "flux_norm": 1.008062, "area_msh": 849.841894, "tilt_deg": 19.254535, "complexity": 0.388801, "polarity": "leading_negative", "confidence": 0.65}, {"id": 28, "birth_seconds": 97200.0, "lat_deg": 20.381805, "lon_deg": 225.278945, "flux_norm": 1.196315, "area_msh": 1037.022215, "tilt_deg": 8.1368, "complexity": 0.49279, "polarity": "leading_negative", "confidence": 0.65}, {"id": 29, "birth_seconds": 100800.0, "lat_deg": 18.999547, "lon_deg": 317.479266, "flux_norm": 1.185142, "area_msh": 830.672733, "tilt_deg": 14.838592, "complexity": 0.378152, "polarity": "leading_positive", "confidence": 0.65}, {"id": 30, "birth_seconds": 104400.0, "lat_deg": 19.386953, "lon_deg": 356.425626, "flux_norm": 1.389063, "area_msh": 1092.856294, "tilt_deg": 16.769209, "complexity": 0.523809, "polarity": "leading_negative", "confidence": 0.65}, {"id": 31, "birth_seconds": 108000.0, "lat_deg": 23.371811, "lon_deg": 62.38812, "flux_norm": 1.752967, "area_msh": 1279.487964, "tilt_deg": 6.3799, "complexity": 0.627493, "polarity": "leading_positive", "confidence": 0.65}, {"id": 32, "birth_seconds": 111600.0, "lat_deg": 17.580359, "lon_deg": 96.852723, "flux_norm": 2.047244, "area_msh": 1667.578448, "tilt_deg": 14.159927, "complexity": 0.843099, "polarity": "leading_negative", "confidence": 0.65}, {"id": 33, "birth_seconds": 115200.0, "lat_deg": -19.749646, "lon_deg": 312.837117, "flux_norm": 0.477745, "area_msh": 1020.78127, "tilt_deg": -15.925352, "complexity": 0.483767, "polarity": "leading_positive", "confidence": 0.65}, {"id": 34, "birth_seconds": 118800.0, "lat_deg": 17.785553, "lon_deg": 123.171689, "flux_norm": 0.633004, "area_msh": 1614.773046, "tilt_deg": 20.515271, "complexity": 0.813763, "polarity": "leading_positive", "confidence": 0.65}], "calibration_state": "normalized magnetic units; physical Gauss/Mx calibration not asserted", "fields": {"br_normalized": {"units": "normalized magnetic field", "values": [0.0, 0.0, 0.0, 0.0, 0.0, 0.0, 0.0, 0.0, 0.0, 0.0, 0.0, 0.0, 0.0, 0.0, 0.0, 0.0, 0.0, 0.0, 0.0, 0.0, 0.0, 0.0, 0.0, 0.0, 0.0, 0.0, 0.0, 0.0, 0.0, 0.0, 0.0, 0.0, 0.0, 0.0, 0.0, 0.0, 0.0, 0.0, 0.0, 0.0, 0.0, 0.0, 0.0, 0.0, 0.0, 0.0, 0.0, 0.0, 0.0, 0.0, 0.0, 0.0, 0.0, 0.0, 0.0, 0.0, 0.0, 0.0, 0.0, 0.0, 0.0, 0.0, 0.0, 0.0, 0.0, 0.0, 0.0, 0.0, 0.0, 0.0, 0.0, 0.0, 0.0, 0.0, 0.0, 0.0, 0.0, 0.0, 0.0, 0.0, 0.0, 0.0, 0.0, 0.0, 0.0, 0.0, 0.0, 0.0, 0.0, 0.0, 0.0, 0.0, 0.0, 0.0, 0.0, 0.0, 0.0, 0.0, 0.0, 0.0, 0.0, 0.0, 0.0, 0.0, 0.0, 0.0, 0.0, 0.0, 0.0, 0.0, 0.0, 0.0, 0.0, 0.0, 0.0, 0.0, 0.0, 0.0, 0.0, 0.0, 0.0, 0.0, 0.0, 0.0, 0.0, 0.0, 0.0, 0.0, 0.0, 0.0, 0.0, 0.0, 0.0, 0.0, 0.0, 0.0, 0.0, 0.0, 0.0, 0.0, 0.0, 0.0, 0.0, 0.0, 0.0, 0.0, 0.0, 0.0, 0.0, 0.0, 0.0, 0.0, 0.0, 0.0, 0.0, 0.0, 0.0, 0.0, 0.0, 0.0, 0.0, 0.0, 0.0, 0.0, 0.0, 0.0, 0.0, 0.0, 0.0, 0.0, 0.0, 0.0, 0.0, 0.0, 0.0, 0.0, 0.0, 0.0, 0.0, 0.0, -5e-06, -0.0, -0.0, 0.0, 0.0, 0.0, 0.0, 0.0, 0.0, 0.0, 0.0, 0.0, 0.0, -0.0, -1e-06, 1.3e-05, 0.0, 0.0, 0.0, 0.0, 0.0, 0.0, 0.0, 0.0, 0.0, 1e-06, 0.0, -0.0, -0.0, 5e-06, 0.0, 0.0, 0.0, 0.0, 0.0, 1e-06, -0.962866, -0.181466, -0.0, 0.0, 0.0, 0.0, 0.0, -1e-06, -0.005496, 0.038316, 0.0, 3.4e-05, -0.005454, -0.000752, -0.649595, 1.25, 0.002463, -0.001745, -0.0, 0.0, 0.0, -0.0, -0.00011, 0.0847, -0.249875, 0.20492, 0.017149, -0.0, -0.277912, 1.042577, -0.00182, 0.077612, 2.9e-05, 0.0, 8.8e-05, 1.033163, 0.408552, -0.028057, -0.0, 0.0, 0.0, 0.0, 0.0, -8.4e-05, -0.897544, 0.066841, 0.0, 0.025849, 0.354612, -0.02561, -0.010027, 0.006046, 0.343713, -0.116304, -0.0, 0.0, 0.0, -0.000114, -0.794487, 0.709467, -0.074749, -1.185035, 1.047929, 1.5e-05, -0.014364, 0.005477, -0.011019, 0.01774, 1.3e-05, 0.0, -0.003859, -0.401987, 0.0, 0.0, 0.0, 0.0, 0.0, 0.0, 0.0, -0.0, -2e-06, -0.0, 0.0, 1e-06, 1.2e-05, -0.0, 0.0, 0.0, 2e-06, -0.0, -0.0, 0.0, 0.0, -0.0, -6e-05, 0.0, 0.0, -1e-05, 3e-06, 0.0, 0.0, 0.0, 0.0, 0.0, 0.0, 0.0, -0.0, -2.5e-05, 0.0, 0.0, 0.0, 0.0, 0.0, 0.0, 0.0, 2e-06, 0.0, 1.1e-05, -0.0, -1e-06, -1e-06, 0.0, 0.0,